text,label
"Karachi: World Eleven Ki Aamad Tour Nhi Hai Balki Cricket Ki Aalmi Baradari Ka Pakistan Se Izhaar Yakjhati Hai, Rameez Raja Zahid""",0
Kaise baat Krte Ho... Like Gla dabaya Ho..  Politics m aise hi aaroop lagye jate h Jiii.. Jababdehi to gov ki banti hi h.. Bachho ka sawal h,0
Haraami politics khela. Bara player hai jab chaahta hai andar bahar karta hai jab chahta hai lul hojata hai,0
"Sab Kuch Bikne Ko Tayaar Hai Iss Duniyaa Me, Bas Kabhi Kuch Paise Kam Pad Jaate Hain. #Sarcasm",1
Yaar tu politics logo ke lie join Kia Ya modi ke lie ye Bata De tujhe Teri maa ki kasam,0
@SumitGopal1 oh bhai aap toh baht hi cool ho -.- #sarcasm,1
"#SakshiMaharajin behen k london ko kab akal aayegi, bhartiya sanskrit khatre me bol kar apni politics chmka rhe h. Sala tharki buddha.",0
Apne Mullo se puccho triple Talaq and halala kab khatm kr rahe hai..think about ur society,0
@officialDhoniFC Hi sir  Main bhi cricket khelta hu aur aapke saare shots sikh sikh kar khelta hu aur mera game acha ho gaya h reply dena.,0
"Firoze saheb ki photography hi unki jubaan hai.. Aur unki unique jubaan politician ko padhna nahin aata. Yahi #irony hai   Bidu, follow him",1
Jaise up me akhilesh ka ho raha ...!!  Woh na Ghar ke rahe aur na politics ke ..!!,0
just abolish #TripleTalaq like sati pratha and baal - vivah. kuritiyan bhale hi dharm se judi ho pr hoti to kuriti hi h,0
Yahi cheez sambit patra ko bolo wo pese se DR. Hai wo chutiya politics kyu karta h,0
"@SZaidHamid papaji ko bol kar bollywood mein bhi arakshan karva lete... talent mei to fail ho gye, kahi arakshan se hit kar jate..",0
Sir agar aap Bollywood me Safal ho Gaye hote toh shayad Bharatdesh roz 5 se 6 #taalthokke superhits naa dekhne Ko milte @sardanarohit,0
"Jis desh me #Cricket ka junoon ho,wahan agar log #Badminton dekh rahe hain,to ye kuch aur nahi balki #Indians ka pyar hai @Pvsindhu1 ke liye",0
"NA TRAIN ME YATRI SURAKCHHIT, NA HOSPITAL ME BACHCHE SURAKCHHIT NA JAWAN NA KISAN.  NDA H POST SURAKCHHIT H  . YE ORIGINAL POLITICS",0
"Pehlay tumhari sarkar kuch ker nahi parti, aur baat main janta k paise ko day ker hero ban jatay ho #India #Politics",0
@NadeemfParacha 1971 say lay ker aaj tak hum sirf iss mulk ko bacha ya baja rahay hain :D #Irony @MUsamaKabbir @javeednusrat @marvisirmed,1
Dhandha pet ke liye karte h humare paaji aur politics desh ke liye...,0
Bahenchod achha hai ki leave kar raha hai aur tu bakaiti kar raha hai ki Bollywood k wajah se nahi kar raha  abe agar koi star chahle togaya,0
Ghatiya teams ke sath cricket khelkar aaoge to yahi anzham hoga.. sab glti #BCCI ki hai,0
triple talaq pr faisla ata he to  muslim usse accept krta he or jub ek rapist ram rahim ka faisla ata he to ye sab?muslim phr bhi badnam he,0
To Fir modi Ji ko Hindu relation ke lie bhi lal qile se bolna chahiye he Ye to triple talaq se bhi bura he .,0
SuNo baiYoN yE bOllYWooD kE khAAs loG hAi ye hUm AaM inSaNo ki bAaT kA jaWaB kYu deN gaY,0
Triple Talaq gone Maulana sahib log jis tarah Republic Channel par gussa dikha rahe the saaf hai ki sab ke pichwade SC ka decision laat hai,0
"#GurmeetRamRahim ke cricket tournament me Chauka, Chhakka ke saath Attha bhi hota tha. Aise kaam ke liye toh isko Faansi de deni chahiye",0
Politics is more than #NewIndia . Wah bhaiya ji wah aise to aap aa hi jaoge satta me,0
Hindu daram par @TripleTalaq  lago na hone ki waje se Hindu orto par julm ki koi intaha nahi   Me Hindu baheno ki sat hu,0
"#TripleTalaq ""Modiji woh teen talaak ka matter clear ho jaaye,  toh woh saat janam wala matter bhi dekh lijiye please.""",0
New Photo From Film Dil Ka Kya kasoor 1992 In Song Khata To Jab Ho Ke....... #DivyaBharti #DilKaKyaKasoor #92s #Bollywood #RememberDivyapic.twitter.com/oYBIShZSE6,0
#Cricket khelo fit Raho... #AkshayKumar ko dua karte raho... #HappyGaneshChaturthi @akshaykumar @mrsfunnybonespic.twitter.com/CJP9v4IiAc,0
@RahulBose1 Fir bhi mera bharat maahan. #Sarcasm,0
@narendramodi JO KAR RAHE HO NA WOH POLITICS NAHIN HAI BHENDUAGIRI HIJARAGIRI DOGALAGIRI HAI .SHREYA GHOSHAL KI SHAADI SE ABHI TAK DESH PAR,0
#Bollywood #contestalert  1. Hawa HawA 2. Chalti hai kya nau se baara 3. Kaala chashma.   jachda e gore mukhde pe,0
"Jub dekho politics , kuch nahi ho sakta aap logo kaa shame ,",0
"""Kamino.....Tumhara triple talaq aur RamRahim ka topic khatam ho jaye tho meri dhamki pur bhi focus Karna """,0
SRK is a baap of Bollywood . 2-4 movie se kuch nahi hota shaid tu baccha hai issliye sabke bure din toone dekhe nahi hai,0
Bharat mein bhi kuch karo Triple Talaq aur Halala ke liye.,0
Bro focus on ball more than biceps.kyunki biceps se cricket aacha kela jata toh khali aaj captain hota aap nahi#kadwevachana,0
Congratulations LEGEND @msdhoni   Mere Cricket Ki Duniya Aap Se Shuru Hoti Hai Aur Aap Par Khatm.... :)  Love You MAHI  #Dhoni300pic.twitter.com/GYdcVO7JLN,0
100% true. Mamta ki yahi politics hai Muslim aabadi badhao aur raj karo?,0
TERA BAAP HAI MULLA. SAALE CHOR UCHKE DESH KA KALANK HAI TU LAALU. MAUT PER BHI TUM DAKAIT CONGRESS AUR LAALU POLITICS KHELTE HO,0
AJJ JO SAWAL / SINDH JE UNN SAKAFATI TAAREEKHI SHAHAR (MAAG) JO NAALO BUDHAYO JANHN JE NAALAY SAN BOLLYWOOD MAI FILM THAAHI WAI?,0
@SPNSports_cricket 300 se adhik,0
Mujhe lagta ki Ravish ji ko politics m ana chahiye tabhi kuch hoga,0
: Tujhe cricket chhod Chacha ki yaad Q aa rehi ?,0
"Rakhiji ,Desh apka h politics me jao,apne vichar alag ho. Rastriya partiko saman hume Apne Mata - Pita ki tarah karo.",0
"bjp hatao desh bachao,dharam jaat ke naam pe politics karne wale,baccho ko marne wale desh k gaddaro ko sare desh wasiyo bharat se bhagao...",0
Gew serajul-haq sahib 100 sal gew aaj aap nay JI ko aik nai liberal soch dee cricket ko halal game man Kar qabool Kar k JI ke old policy rad,0
"The #TripleTalaq debate with Ratan Sharda, Zeenat Shaukat Ali, Nasir Pathan Anand Narsimhan and Tanvi Shukla. pic.twitter.com/u085y4alJB",0
TRIPLE TALAQ MARDO ka ho gaya MODI N YOGI KUCH KARO AAMIR KO JAIL MEIN DAL DO PURE BHARAT KI APSE GUHAR HEIN,0
Uniform Civil Code agar chaiye to triple talaq ko khatm karna hoga aur inn nakli islamists ko mahilayon ka samman kaise kiya jata h batana h,0
Bhai ye modi k bhakt ek no k chutiye h inhe bs har jagah apni politics nazar aa rai h,0
huma mante hai kuch aise log hai humari community m pr india m inse jyada aise terrorist hai jo k muslim nhi hai...kuch to politics m bhi ha,0
"Nadaan Parindey Ghar chale jaa :) ""@thevaas: ""ROCKSTAR"" -In competition at #OsiansCinefan. Epic win! #sarcasm""",0
"ek har nahi pacha sakte to cricket dhekhna chod do, Because #CT17 final ke waqt hi sabki aukat dekh li maine",0
#KejriwalToughtMe Paise ki Kami Nahi hai #Sarcasm,1
Congees Bhadwe #TripleTalaq ka comparison Ram ki astha se kr rhe  2019 me Hindus k Vote v chahiye inko  @KapilSibal baja 2019 me,0
Soch soch ke ghin aati hai politics ke duhre charitra ko dekh ke ki vote bank ki rajniti me kuch v ho sakta hai? Arakshan dwesh phailati hai,0
Ek Kaam bhool Gaya   Ki #TripleTalaq pe Pani fer diya. Tumhari HALALA ki dukaanein band hone wali hai.,0
Ye sale ka vote bank politics har vakth.. ye andha hai hi our log jo baba logo ka Pooja karthe hai usse jyada andhe,0
"Bhaiyyon cricket ko kam se kam nafraton se duur rakho ye request hai, and I know aaplog k bhi dil saaf hain. Love from Karachi to Indians",0
"Sans lena Triple talaq Bakri suar pelna Halala Aur biryani khana  Aur han ""Khatna"" Bas yehi sab haraam nhi h..",0
Isko to JOB lagni hi thi. #bollywood #celebrities #SharmanJoshipic.twitter.com/iprhPjJRLA,0
"Desh ke kanun vyvastha pas se hamara vishwas vaise hi uthta ja raha Hai...triple talaq ban Kar Diya...bataiye, kaisi nainsafi hai",0
"Yar Jo Chahta hai Pakistan me cricket ho he na, Wo Apni haar Kese Dekh paye ga yar, #BurnolImranBurnol",0
@ashajha yaha 14.20% Muslim's ne #TripleTalaq pr #SC k faisle ka samman kiya or waha #panchkula me #RamRahimVerdict challenge bana baitha h,0
"Sir ji apne kaam pe dhyaan de..janta janrdhan hoti h,bheed dekh k anumaan na lgaye nd pls lets upheld the politics of bihar dont degrade.",0
Main karu to saala charecter dheela hai.... #irony :-/,0
Mai bi hu triple talaq real means miya bibi m agar problem h to 3 koshish har mahine 1st dono ke maa baap samjhuta karaye ar ek saath rahe,0
Poda lusu payalae triple talaq kum ramar birth day ku vithyasam illa?,0
Chandrasekhar Azad k janmdiwas shanti se gujar jane par 1 insaan Itna dukhi hai.. Jo Khud hi apni choti Soch ka Gulam hai. #irony,1
Ckt News: S Ajmal  Sohail khan k BaaD Ab  Umar Akmal Aur SharJeel khan Ko Be Wajah Cricket se Door Kiya Ja Raha Hai J Miandaad #SiKanDeR_ALi,0
"#RishtonKaChakravyuh #Bollywood Jaani Jo Log Sonay ki Chain Galay May Daltay Hain ,Woh Shirt Ke Uppar wala Button Nahi Daltay !",0
Mujhe bhi cricket khelna hai. pic.twitter.com/pTgt3mP0Fa,0
"Knock knock | Who's there | #Petrol | #Petrol who | Abey saale,Rs 3.14 kya bad gaya, mujhe pehchanne se hi inkaar kar raha hai! #fb #sarcasm",1
Abhi toh bistar bhi mujhe bula raha hai. Death bed . #Irony,0
"Dubai: #ICC ODI Ranking Jari, Junobi Africa Pehlay, Australia Dosray, Bharat Teesray Aur Pakistan Chattay Number Per Aa Gaya. #Cricket",0
mosad.ne.bdla.liya....lakhlakh.shukra.hai.israile.cricket.nahi.khelte.varna.sirf.series.radd.hoti.aur.mamla.thanda.pad.jata,0
@chota_bhim aaye bada ho gya #sarcasm,0
"Haha! @MulayamSinghSP Sir, Politics Badal gayi Hai, Ab Sahi raaste pe aa jaayiye, AAP ki zaroorat Hai Desh ko,@INCIndia Communist se Bachao",0
"Sabhi Bhakton, Liberanduon, AAPtardon, Congiyon ko #IndiaIndependenceDay ki badhai. Aaj to ek rehna, politics to chalti rahegi. #JaiHind",0
@KElectricPk ..Aj International cricket sirf Lahore main Bahaal hogi ya Karachi ma bhi hogi ?? Q ke 7 to 9:30 to loadshedding ka time hai..,0
chorro sir ghar baith k tweet kar leta ya padhai jyada politics karne se yai hota hai kya jaroorat thi jane ki ?,0
Yeh... Kejriwal pe Dhyan rakhana. @AamAadmiParty  wale politics me niche gire huve log hai. @ArvindKejriwal,0
Phr Seeti Bajegi Stage Sajega Aur Taali Bajegi Aur Khel Jamega Lalalalalala laaa lala lala lala laaa #Cricket,0
#BanTripleTalaqNow kaun hai wo haramzada jo triple Talaq ban karne ke liye kah raha hai.,0
Abey triple talaq ka baat chood woh maa ka barey soch jinkey bachey margaye ha saram karo modi .,0
"Kuttay Kameeny Sethi Ko Cricket Board Se Bhair Phanko Salay Ney Humara Aik Player Barbad Kar Diya ""Sharjeel Khan""",0
#RakshaBandhan #Contest In #Bollywood Jodi mein se aisi kaunsi jodi hai jisne kisi movie mein Bhai-Behen ka role nahi kiya hai??? #Vadodarapic.twitter.com/2jM5G3pT6e,0
Rahul Bhai kuch logon ko politics virasat me Mili h... Unke liye raasta easy ho jata h Chalane ke liye.... Mauka Hume b do..,0
@ShubhamSaxenaIN jat Gujarat Maratha vyapam pds surjan cricket  Rajasthan,0
Pathhar wajon Hawa Wajon Ladki Wajon Daru wajon Triple Talaq Wajon Halala wajon ko janta ne shortlist kiya Fir Nakara Work is worship,0
Nukkad aur desh mee kya chal raha hai I m not pushing my nose in this matter chee chee ye politics bahut ganda hai ye budhi wadi log hii in,0
Achha mathematics laga rhe ho ...... khelo politics jitna khelna hai..... Aur jis jis ki marni hai maar hi lo,0
#Bollywood industry kisi ke #baap ki jaageer Nhi hai fir #wo koi v Ho  Well done  queen,0
In so called bhagwano ne god ka majak bana diya medal kya cheez hai. Jab tak vote k lie politics hogi ye drama chalu rahega,0
Bharat band today. LOL. chalu kab tha ?? #India #sarcasm,1
Aapko politics suite nahi kartha Hai... Kyun aap pasie barbaad kar rahe ho,0
"Abe kathmulle mujhe pta hai ,triple talaq banned ho gaya ,roti roji chhin gayi ,twitter par aakar gaand marwa rahe ho....",0
Itni security ke sath tou Kabul mein bhi hojata final. #PslFinalLahore #CricketComesHome #irony,1
Ye Bollywood wale sabhi anti nationalist hai .Sirf bayan baji are jigra hai to gambhir ne abhi do bachche ka padhai ka jimma liya ek tweet u,0
197 maa ki ank  Handsome total bhai Ab jo Amla ney penty lagani he wo dekny ki hogi  #CricektKiHalalala #Cricket #PAKvWorldXI #PAKvWXI,0
Power aur politics ke liye ye hame sirf use karte he..,0
"sharm magar tm ko nahi aati,koi b beemar par sakta hai is par politics mat karo kya pta kal aap is beemari ka shikar ho jao",0
Aaj Sonia ne jatai  Chinta aur kal Pappu LALU aur Kejriwal Jayenge sahanubhuti jatane phir politics  zoor Legi bas Inka kaam hai yahe so???,0
Ab sirf mard hi nahi mahilayen bhi cricket khelne lagi Hain. You made this change....,0
@ViratBharat Raza Murad bahut kaamyab aadmi he. Uski baat sunni chahiye :P  #sarcasm,1
"Barish itni pasand kiyu kar te ho, idar to hamesha houti hai New Zealand mei ke damakh kharaab honjata hai. Cricket kheli hi nai jati",0
"# Chakwal: Kalarkahar Me Eid Par Cricket Match Nay 2 Ghar Ujaar Diye, 2 Nojawano Ko Firing Kar K Mout K Ghaat Utar Diya Gaya, Muqadma Daraj.",0
"Aisi politics nai chalti bhai abhi, kuch dang ka hai to le aao",0
"Triple Talaq Ko Supreme Court Talaq Diya, Iski MATLAB Tum Log Khud Samaj Liya Muslim Mukt Bharat.Tob Pakistan Chala Jao.Koun Rukha Hai?",0
Bhai yehan to cricket ka shubh mangal savdhaan hua pada hai...kuch mat bolo...,0
Jo jyaada alag ho.. Wahi cheej attract karti hai.. Jo bhaav kum de.. Wahi sabko pasand aati hai.. Aissaa kyu? #irony :/,1
"*Chinese President ""Kamino.....Tumhara triple talaq aur RamRahim ka topic khatam ho jaye to meri dhamki pur bhi focus Karna """,0
Pata nahi ye log politics ki kgtaab ka kaun sa chapter padh kar aaye hai jo insaniyat bhula baithe hai.,0
"Aaj kal cricket bohot boring lag raha hai, vahi char desh ghumte rehte hai apne log.",0
#TripleTalaqOver media ka mai triple talaq khtm hone ko@le kr aisa shor hai jaise India se aurto ki problms khtm ho gyi aur wo safe ho gyi,0
Ab log biased hoo pehlay aap khud Subhan Ahmed kaun hai issay nikalo kartay thay. Sethi nay cricket kay liay acha kaam kiya hai,0
oye mika paaji...cha gaye tussi...oye chak de phatte #Bollywood #CelebrityIsland #ShahRukhKhan #Mika,0
Or ab se kuch dair baad aik intehai eham cricket match ki pheli ball duniya kay deshatgardon ko bold kardegi.  #PAKvWXI #CricketKiHalalala,0
Ilangai Cricket Aniyin Thodarchiyaana Tholvi Kuritthu Palveru Tharappilum Vimarsanam; Jayasuriya Thalamayilaana Therivu Kulu Raajinaama.,0
@kitAnurag  *Mahabharat*  Arjun tumhe kya dikh raha hai? A-Machli ki aankh  *Bollywood*  Arjun tumhe kya dikh raha ha? A- Shraddha ki..aankh,0
"Knowledge toh pehle muze Triple Talaq ke bareme bhi nahi tha.. Jo galat hai, woh galat hai..",0
@narendramodi ji or ek bath America politics khel ne main bahut mahir he isliye Russia k Saath pahele jaise frienship  hona chahiye,0
Kyu paise ko waste krte ho wo bhi ek gandi politics k liye...AP ke hi minister 51 lakh dete h ram Rahim ko or AP b,0
"Wah!Log yahaa laaparwaahi me baccho ki jaan bhi le le to shameless Nahi.Politicians whose job is politics, wo apni job bhi karey to shameles",0
70 saal mein kuch upaay kiye hote to aisa nahi hot tum to desh ko lutney ke chakar mei they ab politics khel rahe ho,0
GST day aur CA day ki dher sari shubhkamnaye #Irony,1
@republicHam Hindustani bas Indian cricket team ke liye eak hai. Baki Ham aalag hai KuNhi panchkula mein jo 30log mare gye hai. Swaal puchu,0
Mai bhi badhi ho ke mithali Raj banungi or phir mihali Raj se milungi . Mujhe bhi cricket ka bohot shook hai,0
Jatiwad bharat chhoro; But votebank k liye Reservation s muh na modo  #sarcasm #irony #MannKiBaat @PMOIndia @AkashvaniAIR #indianirony,1
@bhogleharsha bhai ek baat kahna tha lanka ager haar rahi hai to sirf is karan ki india shaandar cricket khel rahi hai England bhi 5-0 hari,0
"@BharatKeVeer #Bollywood ....Yahan pe laundiyan khel khel rahe hey, tum nautanki karte raho...Apne Baap ki Izzat Rakh lo #HappyBirthdayPM",0
Jaha jaroorihoga waha jaroori hogo kya politics jati perAadharithai,0
"Bhaisab, Agar itna paisa hai to pappu Ko de do politics se Nikal jaane ki liye, phaltu me Roz apni izzat ki waat lagata phirta hai !!",0
Sir Triple talaq ke baad ab Hindu working womens ko bhi unka haq dilaye aur unhe unke ghar pariwar se door na kare plz soche is tarah bhi pl,0
Tum kaha badh pirito ki madad kr rhe ho yad rkhna janta dekh rhi ha logo ka sb kooch chin gya aur toom politics kr rhe ho janta sbk sikhyegi,0
Mam aap bhot acchi dhikogi agar apni ye lambi jabun band rakhogi tum bus AAP ki model ban kar raho politics mai kha dimag laga rahi ho,0
Good News # Worlad Elavan Ki Team Aaj Pakistan Phunch Rahi. 1st T20 12 Septambar Ko Lahore Me Hoga #PAKvWI #Cricket,0
Inko koi ungli kare toh civil justice law chaiye ... aur triple talaq ko rokne ke liye toh sharia law... kahan tak bhaagega,0
@iPavanTiwari Aap hi Ne Bataya She Hates Men @Mukesh7009 #sarcasm,1
muslim mahilaon ke bachchon ko reservation digiye kya triple talaq hi mudda hai dusre mudde nazar nahi aarahe hain ya dikhnahi raha hai,0
"Aj whatsapp nai aya, lagta hai wo bhi #Peshawar gaya hua hai.  #Sarcasm",1
"Rawalpindi: Pakistan Main World Eleven Cricket Team Ko Khushamdeed Kahtay Hain,Pur Aman Aur Khail Pasand Qaum Maizbani Ko Baytab Hai,DG ISPR",0
Yahan kuch girls aisi hain jin ko cricket ka pta tak nahi aur match main tasbeeh lai kr aisay beth'ti jaisy aglay tour main inka b naam ana,0
Kar lo sir politics kar lo aap.Aaraam se time le kar poori politics keejiye sir.desh kisi aur janm mein bana lenge.abhi politics karte hain,0
koi baat nh cricket pakistan me agaye is se bary kamyabi kiya hogy,0
@dhruv_rathee jisko Jankari hai wo Teri baat nahi aayege..but tuje pata hai ki Desh ke Yuva zyada politics main knowledge nahi hota..,0
Cricket News Umar Akmal Ko Sabar Se Kaam Lena Chahiye QK Maazi Me  SarFraz Ahmed  K khilaaF Bhi Aisi Sazish Huwe Thi Aur SarFraz Ahmed Ne...,0
"@libyanfsl mashaa Allah, najeehum ya rabi #sarcasm",0
Triple Talaq Too All World Hated Harami Terrorist Mulla Lok Detay Hai.Jiska Nahi Hai Kuch Ma'am Sanmaan O Harami Ki Ollat Muslim Hai,0
Apne jaisa sabko bakait samjhte ho? Wo PM. hai.Tumhe lashon per politics karne ka moka mila hai tum wo karo.,0
Modi n yogi isliye kaha tha TRIPLE TALAQ ke  peechein mat pado AAJ PURE BHARAT KO TROPHY SE DIVORCED KARA DIYA nowhat s upp na email BALL se,0
Nidhi lagta hai ki Desh me bachho ki mott ki Khabar sun ke Dharti maa bhi hil gayi... Aur hum aaj bhi politics khelte hai.....,0
Vote deny waly hi na sochen to kiya ho sakta hai is qoum ka.Nali solang ki politics hai gali paki kara do to log kutty ko bhi vote karty hen,0
"@ImranKhanPTI SHREK k phanstey he Gorey or N.SETHI Cricket bhi le aay, Mulk abad ho gya hy, NA-120 k GUTTER se DOOD ke nehrain chal pari hy,",0
"@ZeeNews TripleTalaq pe MULLAS MOULAVIS,Muslim Auraton peZulm karte rehna chahte hein.Owaisi khdeda hawa Naqlee neta Halal ke chakkar me hai",0
#selfnote aaj khush toh bahut hogey tum ?? #sarcasm #facepalm,0
Jo vyakti carodo logo ko yog shikhake nirogi rakhata hai usko hum mante nahi aur khali 1 match jitati cricket team ko hum sir pe bithatehai,0
Pak aur Sri Lanka ki series kb se start ho ri hai ? #Cricket,0
"Apne paise par ghume, koi farak Nahi padta. junta Ka paisa he to Sadgi rakho. Topibazi se Nahi. Vikas gayab? Triple Talaq kahan gaya?",0
Pakistani sabiq leg-spinner Abdul Qadir ne kaha hai ke qoumi Cricket team ko World Eleven ke khilaaf series ko aasan na samjha jaye#,0
Jab @msdhoni batting karne aaye toh bata dena #INDvSL #MSDhoni #India #Cricket,0
Ckt News: S Ajmal  Sohail khan k BaaD Ab  Umar Akmal Aur SharJeel khan Ko Be Wajah Cricket se Door Kiya Ja Raha Hai J Mi.,0
Desh me Rashtra geet ya Rashtra k hit me koi v ho.... USKE khilafat krnewala ya to murkh hai ya to SiRf Dirty politics karna janta hai,0
Triple Talaq is GSTed now. Samjhe...? Nahi Samjhe to Ghanta Samjhoge Tum!,0
4 saal se mai jab bhi bollywood actor banne ki baat sochta hun to koi na koi chhik deta hai ya fir light chali jaati hai,0
Aamir Khan  @aamir_khan #AamirKhan #priicreationz #bollywood pic.twitter.com/EGSegm5zy0,0
"Mera Cricket k sath Ishq, AFRIDI SE SHURU HUA THA AFRIDI PR KHATM HUA HAI #ThankYouAfridi @SAfridiOfficialpic.twitter.com/DHckIh8j1B",0
In saale pehalwanon cricket khiladiyon ko raajneeti kya samajh aaye? Inko inki aukat se jyadaa me mat le ke chaliye!,0
Rahul ji aap log yeh kisi k bhi marne per politics mat kariye please marta hai jiska usko pata chalta hai aap to apni roti sekne jate hai,0
Jab b koi cricket series aati hai Alina yaad aati hai   Kahan gaye usay dhoondo... #PAKvWXI #CricketKiHalaLala,0
"tumhara bas chalta to by road le jaate, aur 30 ki jagah 3 lac marte. Politics k liye kuch b karoge",0
Baba politics bhi nahi karte ye bevkoof log bhagva pahan ke gala fadte hai  sant ko krodh nahi aata  shantchitta wala hi sant hota hai,0
"@ZeeNews Nyra Hasan,Triple Talaq ki Ladai ke liye Muslim Mahilaon ko Himmat se ladna hoga,MULLAS MOULAVIS Gidhdh jaise Nochna chahte hein.",0
#Gorakhpur #muzzafarnagar #hariyana   in sub ko chhupane ke liye  ek #tripletalaq hi kafee hai SHAHEB,0
Triple talaq Aurat ka haq usko dilata he agar kisi aurat ne koi galti ki to usko sudharne ka time deta jo dusre kanoon me nhi..@PMOIndia,0
sachin sir tumala baban chi adhvan te yet asal. Jitki utkrashta tenchi marathi lekhane hote. tetkes utkrashtra tumche cricket aahe.,0
"So, How dare he Ki wo ek neta k rishtedaar ka chlaan kaate Aukaat kya hai iski Ek mamuli sa police wala  #sarcasm",1
sabak to tumhe sikhayenge sab log. kuch log abhi bhi casteism kar rhe hai. apne dad ki politics band karo. and accept ur crimes. B a man 1st,0
Cricket News: Main Khud Afridi Se Alvidaai Match Khelne Ki Paish Kash Ki To Unho Ne Kaha Tha K Mujhe Zaroorat Nahi. Najam Setthi,0
Ranj uthaaney se bhi khushi hogi || Pehley dil derd-aashna keejay #Ghalib #ranj #derd #irony,1
"Aaj dhoni ko god, magic man bolnewale kabhi usiko gaali de rahe the.. Roflol!  #Irony",1
"Bhai, Mubarak ho achhe din.. International cricket ki vapasi ho rhi hai..",0
Agar yeh Sangharsh K Path Apnate Hain Tuub Bhavisya Uujwal Hai Agar Drawing Room Caste Politics Apnate Hain Tuub Nirbal behtar hoga ki abhi,0
"My question to @republic Arnab Jo apni Maa, Bahan n Beti ko #TripleTalaq se Mukt nahi kiye woh Vande Mataram Gayenge ?  #VandeMataramDebatepic.twitter.com/omMN4TXFDn",0
#Rockstar : Toote hue dil se hi sangeet nikalta hai... | #Exams : Chhoote hue syllabus se hi paper nikalta hai ! #IRONY,1
"Sahi keh rahe, isliye abhi 3saal kewal kaam kijiye baad me 2saal politics.  @UPGovt @BJP4UP",0
Kamaal Hai yaar yaha log minority appeasement politics se pareshan Hai aur inhe Ulta hi dikhta Hai.,0
Shaadi karni hai tho apni gf se karo !! Doosron ki gf se shaadi tho apne gharwale bhi kara dete !! #desi #irony :p,1
Maidam ji triple Talaq ke bare me kya khyal hai....,0
Tu laga reh bhai ...Kaamyab nahi hoga its a promise. Politics ka pehla niyan hai use hona nahi hai use karna hai,0
Tu janta nai hai bhai ko #DelhiLingo #Sarcasm,0
"@sardesairajdeep @BDUTT @sagarikaghose @RanaAyyub AAJ DUKHI TO BOHOT HOGE TUM! #TripleTalaq tum itna qrahe ho, kya gum h jo chupa rahe ho",0
Haha iske bolne se Kya hota h. Triple talaq hataya na,0
Kushal log apni kushal ta Politics  me Yahan idhar udhar ghumke hi nikaal dete hai humne to Har jagah dekha aarachan hi Kaam karte hai Truth,0
Mubarak ho bhai pr duwa hai ki aapke bete ko politics ki gandgi se dur ek pyaari si zindgi mile,0
NeWz: Pakistani Awam Ka Cricket K Leye Junoon Aaj Bi Yaad Hai.  #CollingwooD **   #D/J_BALOCH*,0
@moeedu Chalo shukar hey koi AIK to nikla #Zardari ki neeyat ko samajhney wala! #sarcasm,0
@flypigmk uski gand mein dum hai.. agar kisi aur ke gand mein nahi hai to uske baap ka kya jaat hai... #sarcasm with #gand,1
Dusro ko maa behen ki gaali dete hain...aur twitter pe mahaan bante hai..#baniJ ko support kar ke !! -_- #irony #BB10,1
"Nahi suna kyunki triple talaq shayad hi kisi ko hogi, Par apni biwi ko talaq diye bina chor dene ki saza suni hai",0
Tu Jo Mili.. Ekk Din mujhe.. Main kahi ho gaya Laapata..   #aadeez #nation #pakistan #india #peace #AtifAslam #INDvAUS #music #Bollywood pic.twitter.com/0pdeud7vFT,0
Saram hinduo ko aani chahiye bollywood ke bhi kuch log h ..sonaam kapoor jaisi muslim dalal bhi ...jinki hindu movie dekhne jate h,0
"Ye mandir ke topic pe baat kar rahe hain. Inse 3 talaq pe poocho jara. Ghar me kitne Triple Talaq hue, kitni baar Halala hua ? Poora detail",0
Jazbati nahi hona chaiye cricket khelte hue,0
Triple Talaq to abhi ban hai na ! fir ye kaise hua,0
......jaroorat hee nahi padi.......32 vaisae hee......maarae gayae...vaisae aap nae galat field chun liya.....aap politics mae try kijiyae .,0
Gumnaam hain watan par mar-mitne wale Desh-drohi Naare lagakar mashoor hue ja rahe hain  #Irony,1
Superhit @BaahubaliMovie hue #Prabhas ki aur gaand maar li logo ne #Bollywood aur @iamsrk @BeingSalmanKhan @aamir_khan ki free me.,0
Out hone ke itne der baad bhi Murali Vijay trend kr rha hai.. Pr itne der se khelne ke baad bhi Suesh Raina trend nhi kr rha. #Irony #IPL,1
"Bollywood me ab Khan Sultanat ki khatma aa gaya,Salman ke bad ab Shah Rukh ki flop hone ki Bari. Achche actress ko film me lena  tha na.",0
Shruti ji rahul gandhi ji par koi bhi criminal case nahi hai or poori modicabinet criminalo se bhari padi hai politics se bahar to inko karo,0
3 baat ke vich v cricket honi hi chahiye boh chahe kha v ho,0
Vikas Ji Aap sahi kah rahe ho sirf karwai karte rahte hai baad me pata chalta hai inhi ka neta hai. Ye politics bhi bahut kharab cheez hai.,0
"Ab nahi hoga Sri Lanka ke saath cricket series Lagataar, Isliye Abki baar Modi Sarkaar.",0
Bahenji Allah aap KO accha.rakhe. Sab politics kar rahe hai.Kash hamare social worker aap jaise ho.,0
@samiprajguru Jo cricket ki baat Kare vo hi best news channel hai..Aur wo hai @indiatvnews and Kung Fu Pandya ki batting dekhkar Maza aa gya,0
Shareef wo hai jisay moqa nae milta! #irony,1
helloMedia? Ji sir! Koi gadbad hogayi kiya?Are yeh rozgar ka mudda garam ho raha he. Zara tripletalaq par koi debate karao.,0
waqt aane par gadhe KO baap banana padta hai wali politics,0
