text,label
talaq ki politics puri ho gayi ab naya mudda aane wala hai.,0
"Do lafzoon mein yeh, Bayaan na ho paye #6YrsOfBodyguard @BeingSalmanKhan @BollywoodGandu @bollywood_life @Bollyhungama @ETCBollywood",0
jum gayee bus cricket reh gayii jo kuch logo ki bapoti ban gayee hai.,0
Pehle Delhi ke to halat sambhal lo fir UP ka rukh karna.bacho k sath jo hua usase hume v thes pahochi hai but aap ise v politics se jod do,0
abhi chaat k kya matlab. Jisko samjhana tha samajh gaya tum sale intrviw to saare englsh mein dete to Bollywood kaho HIndi Film indutry nahi,0
Aaj kal hum saath wale se baat karein yea na karein status update kiya ke nahi yehi jaruri lagta hai #Irony,1
HinKhoj Word of the Day- Guffaw #hindi #English #word #Translation @BareillyKiBarfi @kritisanon @ayushmannk @RajkummarRao #Bollywood #filmpic.twitter.com/tmaahRC9D2,0
Madam aapke piles ka koi ilaj nhi he. Baat ho rahi he triple talaq ki isme hindu reforms kaha se ghusa diye,0
#Irony Kuchh logo ki chaddiya bhi hoshiyar hai aur kuchh log abhi bhi dimaag ki talaash me hai.. :P,1
Jangla buss per Lahori itne khush hojatay hain ke inko daaku bhi rule kareyn toh ye unko choomtay hain #Irony #NA120StandsWithPMLN,1
"Bhai Aal ne Cricket Kb,Khn,Aur kaise start ki thi?",0
Papu gaythey bachho ko dekh ney gay they ki politics Karne agar dekh ney gay they to Kya kiya wey Battey,0
Kuch to aya ni inme. Politics kheli ti ispe pe. Logo ka black pesa white karane ko khulwae the.or gareebo ko dhakke mile.acchha bnaya modiji,0
Triple talaq Kehne Mein Koi dikkat Nahi Hai Badi Khushi se bahut Bade Men ban  kar bol Dete Hain.,0
Rajesh Khanna Jaisi Star Power Bollywood Main Na Thi Na Hai Aur Na Kisi ki Ho Sakti Hai,0
"Ye dramebaz, Shi cheez k liye to anshan Krte nhi, dum h to triple talaq k khilaaf kregi anshan Circus h aap",0
Triple Talaq ke liye offer bhejti h,0
Jitna nuqsaan Misbah aur Afridi nay Pak one day cricket ko puhnchaya hai aur Kisi nay nahi,0
kiya ghazab kartey ho ji?  pyaar se darr te ho ji? darr ke tum aur haseen lagte ho jee... #classic #bollywood #ahmxd,0
Abe Triple talaq nd HALALA ki santan.rape ko support karte ho tumsab pig Islam ke naam par.terrorist ko support karte ho Islam ke naam par,0
Triple talaq musalman hi ko Q nishana vanaya Hindu dharm me bhi talaq hoti he,0
It's Ravi bopara and samit Patel against India! #irony yeh Kay ho Radha hai bhaiya?,0
Life ke liye pani aur cricket ke liye #ViruPanti bahute jaruri hai jani @virendersehwag @VVSLaxman281 @RpSingh99 @StarSportsIndia,0
Ye already patrakaro ko kharid chuki ha vasundhara Royal family se thi par isko bhi politics ne nass kar dia ha,0
mohalla cricket khel ke hi to yahan tk pahucha hun...kisi bhi cheez ki shuruat chote se hi hoti hai...,0
@bollywood_life kya hum bhi aasakte h,0
Jo aaj Tak bana nahi Hai .....Politics pe reporting karo bas baaki KE liye Entertainment channel Hai,0
"@akshaykumar mere pitaji ek #kisan hai,kya koi #bank ke 12lac chukane mai #Bollywood  se #Help karega #news #nana #",0
Doob k vo marein jo tumhare jaise bacchon ki maut pe politics kr rahe hain..laanat tum pe hai jo bacchon ki maut ka tamasha bna rhe ho..,0
Sir inke baare mai Anna hazare ji ko jyada behtar pta h jinki sidhi banayi thi inhone  Politics paisa cheez hi aisi h koi saga nhi,0
Today Hatred Menu @republic  : #LoveJehad @ZeeNews : #LoveJihad with ISIS masala  @aajtak : Triple Talaq @TimesNow: Kashmir separatist,0
Aek tarf pakistan ke dushman pakistan ke khilaf sazish kar rahe thay black mailer hakoomat ki tang khench rahe thay @pakistani politics,0
"@anjanaomkashyap thrashing mim Afzal  ki tere khade hone se kya hoga, triple talaq khatam kaise hoga & he diverts this to lynching",0
"#TripleTalaq  par ban ke bad #CommonCivilCode bhi lagu karna chaiye,  Q ki One- Nation One- Qanoon One- Ishwar & No- Reservation.",0
#desh ki #rajneeti ka hal #kutta_bhoke_hajar_hati_chle_bajar #Triple_talaq,0
Kya aap jaante they? #FultooFilmy #bollywood #RajKapoorpic.twitter.com/ZRw68OaSJ6,0
#TripleTalaq wah galti husband kare aur saza bhugte aurat. Uski marzi koi jan na hi nah8 chahta. Saza pati ko milni chahiye.,0
Hum us mahan Deshawn ke wasi hain Jahan Logon ko kanoon se jyada baba aur maaulvi par Bharosa hai#tripletalaq#RamRahimSingh,0
#YogiHinduCM gajab politics bhaiya..... Koi hindu janmastmi vali baat ko galat  keh raha koi muslim use sahi keh raha.......,0
"SLT20 Cricket Soothaattam Kaaranamaaha ""M Irfan'itku Vithikkappatta 6 Maadha Poatti Thadai Niraivu. Avar SL v PAK Thodaril Vilaiyaadalaam.",0
@bhogleharsha  In 2015. Shikhar Dhawan?? #SLvIND #AskTheExpert @SPN_Cricket,0
Abe india ki jeet dekh dekh kar bore hogaye. Aaj jeet jaane do srilanka ko. Plzz nai to cricket dekhna band kar dunga yr,0
#PAKvsWorldXI sab pagal hogaye ye sirf cricket hai or kuch nahi.,0
Mai @ArvindKejriwal  Dharm Ki politics nahi karta hu...  Kuchh to sharm Karo... @abpnewshindi @ZeeNewsHindi @BJP4India @OfficeOfRGpic.twitter.com/X2EXryrRWN,0
"Swachh (sweep), Bharat.  In Sri Lanka. #Cricket",0
"@sardanarohit kahaan gya ab??  #TripleTalaq par atka hai,  ye kya ho raha hao dekha hai??  @ZeeNewsHindi",0
teri behan ko kisi ne diya tha kya triple talaq bhosdi k,0
Is reply se mujhe andaza ho chuka hai k tm bilkul bhi cricket nahi dekhti.,0
Jis prakar sachin sar ne cricket me aham bhumika nibhaie usi prakar is chetra me nibhaeyange,0
@amir_bollywood  sir Ji mere pas meri kahani hai,0
"#Bollywood M Hukum Chahe Kisi ka Bhi Ho,, Jab Bhi #BADSHAH /  KING Ka Jikar Honga #Google  Par Search Mar lena #SHAHRUKH Ka Hi nam Ayenga",0
Khan sahab Triple Talaq ko koe nhi katam kar sakta but jo log galat tariqe se Talaq dete hai unko islamic shariya se hi Talaq dena hoga..,0
Abhi tak rohtak.  Aur  khanpur ke p g I main Jan aushdhi nahi khul paiye politics ke chalte  Kam se Kam red cross sanstha ko bol do open kar,0
Chutiya..Urdu..Bhi to india ki hai..Aur.. Bollywood urdu use karta hai tum kiya Jung ladoge jao madarsa pado jake,0
Ludo Har jaate Han Cricket bhi Har Hi Gay Thy  Tweets men tou Jeet Jaen  Badamiiii Sahabbbb Sirf Dil hi Jeetne aate Han aap ko,0
isko ludo khelna nhi aara hota cricket ki baat karrhi. aur kon thi wo jo bol rhi thi kirti gaali deti,0
Meer sahab ye sab laffazi hai . Kitne Kashmiri mar gYe aaj tak? Aur kitne Pakistani kurban huye? Kashmir Pak politics jitne ka nushkha hai,0
'Baho mein chaali aa'' - Thakur from Sholay #Irony,1
"Jahan Mall nahin chalte, wahan theke chalte hain.. #irony #delhiketheke",1
Tumhara so called kapil sibbal jb triple talaq ko support karta hai tb tumhara aawaj kyon nahi nikalta. Padhe likhe gawar,0
Mai ek baat bolunga sirf ki -  opposition vaalo politics chord do or is Pawan 15 august ko unn shahiddo ki madad Karne ka sankalp lo,0
"Hamare desh main jaan se jayada politics chalta hai...Rail durghtana to bahana hai, @aajtak @sureshpprabhu",0
Ye koi Mudda h Ye to Normal h Mudde to Triple Talaq Love jihad or Ghar vapsi ka h Awaam to marti aayi h marti rahegi #AchheDinKeNiraleSupne,0
@narendramodi @gssjodhpur @VasundharaBJP @AmitShah #jodhpurbanarthana triple Talaq se pidit Roshan Banu ka Bura Haal please help,0
Cricket News Hashim Amla Ne Shaandaar Batting Ki. Thisara Perera Ki Innings Bhi Achi Rahi. Sarfaraz Ahmed #Sufyan Gulzar,0
#JusticeForSharoonMaseeh  Kab tak hum khud ko afzal smjh ke dosron ka khoon bahaen gein? KAB They want to be Muslims but NOT humans #irony,1
India m log jab triple talaq jese muddo s bahar niklenge tabhi to band hoga,0
Jab se smriti politics main aayi hain sarra Hindustan GharGhar ki kahani jaisa hogaya hain roz new episode no progress @KPadmaRani1 @neo_pac,0
#Irony at its best. Jisko bachana chaha wahi jaan lene pe aa gye #KanhaiyaKumar,1
"bollywood wale  ,film banate hai 5 lakha me , kamate hai 500 crore . ..aur banate hai chutiya hindi bhasi logo ko",0
kuch bollywood actress bahno aur netawon ke bare me bhi socho muslim se jyada hindu dharm me talak hota hai,0
Main bhi Lahore ja raha hun aur cricket bhi Lahore aarahi hai,0
Kya aapki mund budhi ko itna samachh nahi aa raha ki SC mein govt ko bhi apna stand batana tha aur govt ne triple talaq ke khilaf stand liya,0
Sir agar vote bank ka politics hota to Parrott of modi to baba ko dosi hi nahi thahrata. Khattar ki galti hai ki situation handle nahi kiya.,0
Khud ko waha pr sabit karo apne kabhi ye samjha hi ni ki starting se hi tum sb politics ki katputli bn gaye ho.,0
"Sallu bhai, aap abhi bhee bahut smart dikhte ho... bollywood join karlo bahut free time hai aajkal. U can challenge original sallu bhai.",0
"Aap logon ko ispe kewal politics karni h,aap logon ko mauka mil gaya Twitter pe bakwas karne Ka.sare politicians ek jaise hain.",0
Maaf kar de bhai sahib. Aap Triple talaq mein PHD karein,0
Me yah bhi kahta hu ki me Bollywood ke sabhi sitaaro ko me jaan se bhi jyada chahta hu khas kar k 90s ke lekin aap ko dil k kareeb rakhta hu,0
Shaadi ka band playing 'ho gayi teri balle balle....ho jayegi balle balle' :P #Irony :D,1
Oh bhai ma khud nahe gaya. Kabhe ghar ma nahe dekhe cricket stadium ma amb dekhne the,0
Mere Khayal Me Karachi Me Sub Se Ziyada Hajoom Hota Hai. International Match K Bare Main Suna Tha. Sub Log Cricket Se Pyar Karte Hain. Paul,0
Aur kitne ache din chahiye  #RamRahimVerdict #TripleTalaq #RightToPrivacy,0
@BajwaTayyab @ShkhRasheed #SKH Aik aur NoJawan and NaAzmoda Saaf Pak Politician PTI main Araha hai #Irony,0
@ShirazHassan Plagiarized from aao bacho ser karaaen tum ko hindustaan ki #irony @iam_pakistan,0
aap toh pdh likh kr v kisi kaam k nahi...doctor ki degree kidhar se liye ..koi kaam k nni the isliye politics join kiye naa re gadha,0
Ab ye poori tarah se sidh ho chuka hai ki srilanka duniya ki sabse kamjor cricket team hai.,0
Kela sujhao de... Phle gau mata aur triple talaq se to bahar aajao,0
Pakistan mai cricket ki wapis aney par Awam khush or pur josh hai,0
Triple talaq khatam ho gaya..aak to bada rooi hogi tu .. video daal de tera ronna dekh k meko kich sukun mille..,0
In politics jo dikhatahe he vo nahi hota jo nahi hota vo dikhta jarur he,0
Hm cricket nhi dekhte but.jab bharat jeet'ta hai to khushi bhot hoti hai,0
Ye khauf mujhe acha laga!  #RohitSharma #MikeHussey #Australia #Cricket #India #IndvAuspic.twitter.com/rORX5yR3dS,0
@ShirishKunder Sangat ka asar hai Bhaijaan! #Sarcasm,0
Humare politics ke hero ye bta do mujhe ki @Gorakhpure me Jo chote Bacho ki maut huai Hai uska jawabdehi kaun hai.kya wo desh ke future NH t,0
Ek Mard ka Sar  #kuchkuchhotahai #bollywood #cinema #film #acting #GameOfThrones #MondayMotivation #Mayweather #likeapp @likeappofficialpic.twitter.com/85Eh6RFgZN,0
aap ne jo cricket me uplabdhi hasil ki he veisi hi uplabdhi arjun bi hasil kare ye ummid rakhte he meri family.,0
Triple talaq par aapki soch acchi hai . Hazaro saal pehle prophet muhammad ne women education aur unko property me haq dilane ki baat kahi,0
Is Ko Kaho Thori Si Cricket Khleni Bhi Seekh Le,0
Delhi ka CM hai bhi aur pta bhi nai chalta #Sarcasm,1
Tu bhul ra h abhi filhal 6 mahine ka ban h triple talaq pr,0
Chhat pe cricket ke liye bat ki jagah thapi aur  akhbaar ke upar dhaga lapet ke banai hui ball..,0
#AishwaryaRaiBachchan with Aradhya at the #IFFM #Jinnion #Bollywood pic.twitter.com/3dxQo1k3Ev,0
Jab Pakistan Ka Aur Cricket Ka Naam Ata Hai  Tho Dil Aur Dimaag Mein Ek Naam Chal Raha Hota ha  @mir_sana05,0
Abe chutiye tujhe to koi apni team mein nahi leta hoga Bachpan mein. Cricket khelna ata bhi hai tujhe tatte?,0
Pakistan wale barma k liye kuch karo ya bas cricket hi khelte raho ge shahid afridi,0
@soulyhaque Bhagwan Teri raksha kare beti #dramatic #sarcasm #ihatesimoncowel #randomtags,0
Para 17 gov ne research k liye china bheja hai kyu ki nyay vibag spast nhi kr pa rha hai uss para mai politics nhi nazar aa rhi hai gov ko,0
Ise Kahate hai dogalepan me phd mohatarma aaj tak triple talaq ke mudde pe moo nahi kholi ek mauka laga whole community ko target kar diya,0
Ho sakta hai ye sab politics ki wajah se ho,0
Aakash ji plz purnai tasvire share Kiya Karo .hame bhi acha lagta hai aapke purane photo dekha ..#Cricket,0
"Look agr Indo-pak series har bar hoti to viewership ashes se bhi jyada,imfact WC se bhi jyada aayegi aur boards ko bhi fayada hoga,CRICKET",0
Jaya Bachchan visits Rajesh Yadav's Ganesh Pandal  #cine #home #valladolid #spain #ocio #bollywood #movies #follow #likepic.twitter.com/wOElkEQhy4,0
Itni patli ho gayi Kay nazar he nahi arahi #sarcasm,1
Vote bank politics jabtak hogi desh aise hi chalega desh ki chinta kisko hai sabko apni party ki sarkar ki chinta hai,0
"Sir @ptshrikant abhi kewal kaam kare,  Bayaanbaaji Ya politics performance dikhane k baaad Kare @narendramodi @yadavakhilesh @UPGovt",0
Hahahaha ab wahi ek dwaar bacha b hua h #PresidentialElections2017 #LKAdvani #BJP #Sarcasm,1
"Sabse chota hun par sabse jyada gussa mujhe hi aata hai, kisiko manane bhi nai deta. (usually chote ko jyada manate hain) #Irony",0
haaaa...batao Bollywood ke kitne bure din aa gaye hai.gandi nali ke keere ke alawa kuch nahi hai tere jaise log..,0
"Is chutiye ko kaun vote dega,Bohot saare chutiye aa chuke hai modi ke naam pe. sad ki ind me 100 honest admi bhi nhi jo politics join kre.",0
@Riteishd bhai aap politics me permanent ho jao waise bhi filme to 2 kaudi bhi nhi kama pa rhi kyu producers ko bhikhari banane m lage ho...,0
ji sir sahi kha apne rahul ne puri politics ko bekar kr diya hai,0
Chinese President Tweets in Hindi  Kamino.....Tumhara #TripleTalaq aur #RamRahim ka topic khatam ho jaye tho meri dhamki par bhi focus Karna,0
@ZeeNew Triple talaq dainai walo ko saja dainai baat nahi kiya ja Raha hai,0
"Wah behen, jab triple talaq se itni auraton ki zindagi nark banti hai to tumko fear loathing in India nahi lagta....",0
"Modiji #TripleTalaq ki baadme socho, pehle ye aunty ji ki Ghar wapsi karwao, ye Love Jihad wala mamla lag raha hai, plz rescue her  pic.twitter.com/hXQHWr5n4h",0
"chand vote k liye apne dharm, Maa Durga ko koi kese apmanit kar sakta he.. #Anti_Hindu #promuslim #Dirty_politics.",0
#AazadiKaBatwara Ab wo din dur nahi jab desh m Mahabharata hoga ghatiya politics ki wajah se aur koi rok nahi sakta jai hind jai bharat,0
Ye asmani kitab ne nhi hmlogo ne hi aisa chutiyapa pal kr rakha hai. Desh ko bs kaise bata ja skta hai aaj ka politics hame yahi sikhata hai,0
Jo Hua So Hua Par Ab #Bollywood Waalo Ko 10 Year Tak Rahat Mil Gyi Hogi.... #RamRahimSentencingpic.twitter.com/2D6wSB1qfu,0
Kuch bhee ho sakta hai! Politics me.,0
"Dekho ""Time"" ke pass bhi rukne ka time nahi hai #irony",1
Triple talaq bhul gaye ji,0
Jab Atankvadiyo ko samarthan dene wale Netaon ki Vote Bank khatre me hoti he tab Hindu Atankwad ka Politics khela jata hai. Jai Hind,0
"Aajkal triple talaq ke kisse nazar nahi aa rhe,arey haa ab koi chunaav thodi hai...@Shehzad_Ind @INCIndia @RanaAyyub",0
#TripleTalaq Kuch log to Sirf Isliye Khush ho rahe h ki Islam Ki Shariyat change Kr di Un Iogo se gujarish h Ki Pahle mudde Ki tasdik Kr le,0
triple talaq has nothing to do with these numbers! Pata nahi side argument kyon dete hain log wo bhi aap kaise???,0
aise beokoof bhi apne aap Ko Bollywood ka hero samjhte hai.....sari Hui machli ke aalawa kuch nahi hai Tu jaise log....,0
Wo to triple talaq nahi accept kar rhe ye to Mandir hai,0
@ShazaFK agr ap waiqi insaniyt  k liye #KPK gae ho to..... phir elaaj he kro.... ye elaaj k naam pe politics q kr rahay ho????,0
Kya ham sach me Chinese chizo ka bahiskar karte hai. Hamari bhartiya cricket team ki Tshirt me bade bade achharo me OPPO ka prachar ho rha h,0
Ye soch hamari tumhari hai Politics baj aisa kabhi nahi soch sakte hai jisko chance milta hai wo fayda uthata hai filhal Cong ke pale me Bol,0
Chinese presidents statement- kameeno tumhara triple talaq aur ramrahim ho Gaya ho toh Meri Dhamki par bhi focus Karlo.,0
Ram navami se problem hai. Triple talaq ko support karti ho. Illegal migrants ko sarr pe bitha rakha hai.  Didi sudhar jao.,0
Sir ji cricket dekh rahe hain..aur player ko out de diya hai..,0
"Yahi bol raha Hu bhosdiwalo mere deshwasiyo, chucha karna band Karo politics ke peeche... Padhai Karo aage badho bhenkdolo",0
Logon ko triple talaq aur gai jaise muddon mai hi uljhe rehna achchha lagta hai. Modiji ki koi ghalti nahi hai.,0
Numbers ke liye saala kuch bhi karega. #Bollywood pic.twitter.com/HcFCV03PvO,0
@HaramiParindey  *Mahabharat  Arjun tumhe kya dikh raha hai A-Machli ki aankh  Bollywood  Arjun tumhe kya dikh raha ha A- Shraddha ki..aankh,0
Akhir tum  jaise qoum ke bewakoof kuch nahi karenge toh moulana ko yeh sab karna hi padega na politics hamare liye masla hai solve karna hai,0
Arey kabhi triple talaq ki maari hui un lakho auraton k bhi barey mei socha hai?? Kabhi khud par bhi sharminda ho lo.,0
Kaun se duniyo me ho .....har waqt politics... dhanywaad khajuaate rahiye baith k,0
Aur Jo 30 logon ja Raam naam Satya karwa diya uska Kya .....#shameful #politics,0
"@SirSunnyDeol jitni politics unke sath huwi hai, kuch pata bhi hai tumhe, ye film nahi hai 17 year barbad kiya hai unhone,",0
Bhai politics ma koi b yakeen ke kabil nahi..IK pr aik umeed ha last agr ab vo nahi tu maro corrupt leaders se pyar karo aur khar roz maro,0
"@Swamy39 ""bhagawan ka murti bechke Paisa kamate hai""- iske upad film banake 300 Cr kamaya. #irony",1
Ek bat ka jawab de   Go maa ke Rakshak bhut hai papa ke kiu nahi hai papa ne triple talaq diya isliye,0
@aslipardhaan Bhai Aap He Jo Haryanvi Ko Bollywood me Leke Jao Gye jab Salman Or Srk Bhai Haryanvi Pr Nachee. Love U Bhai #Boysofgudgaawaan,0
Or breakfast ho gaya.apna to pata nahi kam se kam bihari ka to ijjat kiya hota.log Baar se mar rahe hain or ye politics kar raha hai.,0
Cricket News PaKistan Aa Kar Khelne Ka Khuwab Poora Huwa Yahan K Shaiqeen Ka Shukriya. T-Perera #Sufyan Gulzar,0
"Abhi to atyachari mullo ka number chal rha h... triple talaq ban ho gaya Ab Muslim personal law ban hona chahiye aur one nation, one law",0
Virat concentrate on cricket. Kahin tujhe bhi deportation ka order mil gaya toh Rohingya ki team ka coach aur captain banna pad jaayega,0
Ab hamare desh ki muslim shadi shuda mahilao pr se at least 1 atyachar to kam hoga. Baki to sab hi jhel rahe h. Unfortunately  #TripleTalaq,0
Areey bas achha cricket chaiye..sl wi k sath dekh dekh k Pak gya hu,0
"Priceless are these: jhuki jhiki si nazar, pal pal dil ke pas, tuj se naraz nahi, mere sapnon ki rani. #bollywood #music #oldies",0
"Sir movie nahi dekhte kya  kangna ranaut hai, inke rishtedaar door door tak bollywood me kabhi kaam nahi kiye",0
Kuch kaha nahi ja sakta yeh politics hai isme kaun kab party badal de kuch kaha nahi jata,0
Abe ja na nautanki ..apne aap ko Dekh paise ke liye Bollywood actors se shadhi Karlie...Tu konsa dhonghy Baba se kaam Hain ??,0
politics kr ke kya mille ga virat wa ko or chutiye selector ko bhagwaan sab dekh ta hai,0
"Prithviraj Kapoor, Raj Kapoor, Shammi, Shashi, Randhir, Rishi, Karishma, Kareena, Ranbir..... Bollywood ko 'Baap ka Mal samajh rakha hai'!!",0
Bada dukh hota hai bro is tarha partiality ke liye.. ye critics log kiyun aise bollywood n fans ke saath khel rahe hai??,0
Abey gadhe kashmir me kya 1st day se hi ye sab use karna start kar dia tha? Har jagah politics kar raha h,0
Ghorakhpur hatya kand triple talaq se huye kiya,0
@kamaalrkhan Bhai Jann Prabhas bhi hona chaiye is list main usne bollywood 2rs. ppl ke maa bhen ek kardi hai,0
Indian ko bhaut bahut badhai.... Match Jeet Gaye... Kaasss ye desh bhi mhgai say Jeet Jaye...cricket teem ki tarha mantri teem bhi kam kare,0
Kuch bhi kijiye mere monu ko kuch nahi hona chahiye#NoOneKilledJessica #bollywood #quotes #memories #movies #NOKJ #SundayShakeup #Sundaypic.twitter.com/LtcjucHNoA,0
Neha jee... Bilkul sahi.... Sehmat hu aap ke khayaal say... Jee sahi hai jee bhar gaya Modi sarkar say... N relegioius politics say,0
"Shoaib bhai as host aap ko dekh kr lagta nahi kah aap ne kabhi cricket bhi kheli, aur cricket dekh kr lagta hai k aap kabhi host nai ho ge.",0
"Cricket_News: 15_Sep Ko Jo Bhi Stadium Aaye Punjab Bank Se Ticket Ly Kr Aaye, Mujh Se Free-Paas Ki Umeed Koi Na Rakhy. Says: 'Najam_Setthi'",0
"Pata nahin kyon, Lekin ab aap dramebazi aur politics zyada kar rahe hain.",0
Janta aapas me lad mar rahi hai..aur ye log aish maar rage hai.. What a strategic politics,0
Triple Talaq par kisliye astha hua? Triple Talaq nahi hoga to kya sab tabah ho zayenge? Astha adarshwan parhota hei.,0
Sayna nehwal ki biopic m ap kise dekhna chahenge? . #Bollywood #bollywoodactress #synanehwal #ShraddhaKapoor #deepikapadukone #twitter,0
Yeh ramrahim ke gunde cricket me bhi pahoch Gaye Kya,0
Triple talaq ??? Ye kya hota hai,0
"Gujranwala mein aj aik Ahmedi ko qatal kr diya gaya. Larkana mein pora din ""Zinda hai Bhutto"" k naray lagtay rahay. #irony #LakhLanat",1
Yaa sabuut ha Ke loog politics ka liya dharam ko kitna use karta ha,0
"Je baat ! Khangress ke Raj mein #NDARocks ! Bhishab Bahut nainsafi hai ! Ghor kalyug ! Pappu bahut sharminda hai, Bhishab !  #Sarcasm",0
Modi ji kaha ho aap triple talaq par hazir the abhi kaha ho #RamRahimSingh,0
Lady mahilaye Jo politics me hai sirf vote k liye aaj apna riti riwaz  culture badal chuki hai.samjhane wale sab samjhate hai.Jo shi hai,0
Hahaha  Abe chutiye ye original cricket insider ka logo tune bhi laga diya Bade madarchod hai tu @Dcricket_origin wale ke naam pe bheekh,0
Ye kya hoo raha hai is desh ko jo log politics mai aate to hai le kin utpathang bad sirf hota hai mamta ko kisne banaya hai Mantri ..... ??? pic.twitter.com/4LwlzZK4hk,0
Hwa kaisi bhi chle ..Bollywood main toh log pahle bhi sehansah se saath the aur hamesh rahenge,0
@sachin_rt @msdhoni  Sir Bijli Aaj Fir Gir Gayeee @SPN_Cricket,0
Ye Bollywood ki Kejriwal roz nayi bakchodi karti hai par koi iski aur dhyan nahin deta,0
Besharam politicians hai....kuch farak nahi padnewaala hai unhe...2 din shokk manayaenge..phir se wahi apni politics khelenge,0
@mukeshtiwariji Arey hum unko kya materials denge likhne k kiye. Mera majak uda rahe ho sarkar. :-) #sarcasm  @Mukesh7009,0
Abhi tak Hame cricket me out karne wala Paida bhi nahi hua hai agar Hame  agar koi cricket me out kar de usse 101 rupay Diya karate the pic.twitter.com/UJc2GtlfW8,0
Hamary Mulk Mein Roz Cricket Bahal Ho rahe Hote Hai Pata Hai Kyu Kyu ke Ham Log Jahil Hai yeh ek Lolipophai,0
"Cricket News: Pakistan Main Acha Waqt Guzaar Rahe Hain. Shaiqeen Buhat Ache Hain. Wicket Buhat Achi Thi. Hashim Amla - ""Zaheer_Rajper""",0
Good politics...aarmy me bhi aarakshan de do pata chal jayega,0
Mere bhai nhi fauji jo politics krte hn jese bajwa aur zia aur ayub aur pervaizmushbush. Mera bhai sirf wo fauji jo sarhd ki hifazat kre,0
Waapis aa jaa Bhai cricket par,0
"My sis @cool_nikkki is saying that ""Aaj jo Indian Idol ke Grand Finale me aayi to wo Kareena nhi balki uski hamshakl thi.. "" #Irony",0
Waqt ki rah par mera agla kadam mujhko paoge tum jaooge tum jahan meherbaan #UrmilaMatondkar #ARRahman @ashabhosle #Bollywood #dance #musicpic.twitter.com/HBLfHhaQ4V,0
#DekhLenge iss baar Aussie cricket k baare main bhi kuch janta Hain ya nahi pic.twitter.com/Oj75AY1nC6,0
Auqat 6-8 Ka Hai !! Isse Jyada Nahin..Bhik Mange Ga Total Bollywood Se To 10+ Karta Hai,0
Jab zindagi aap per leemo phenke tu aap ko limo-pani banana aana chaiye. :D #sarcasm,0
Ye bollywood model jo bhi kar rahi hai us se ladko ka bala ho raha hai..,0
Sb theek magar #cricket aur #cokestudio ka kya qusoor tha??  Hashtag wali awam,0
*Breaking News*  *Chinese President   Kamino...Tumhara triple talaq aur RamRahim ka topic khatam ho jaye tho meri dhamki par bhi focus Karna,0
@bollywood_life Vaani Kapoor pehle bhi model thi aur ab Bhi model ban kar hi reh gayi hai,0
badh ki halt gambhir h ye politics choriyee  badh pirito ki madad kigiyee bayann bagi bad me so.....,0
Aur triple talaqe to tumhare Papa bhi nhi rok paye aaj bhi ek triple talaq ho gya aur tumhare papa sar khujate reh gya,0
Light aati nhi inke yahan aur humko gareeb bolte hai  #irony,1
"Politics ka level itna niche gir gaya hai ki mp , mla banane ke liye gunde aur mawali rapist babao ka sahara lete hai aur unka sath dete han",0
No hame to khushi hai ke pakistan me cricket dubara ho raha hai,0
"Dekho Pakistaniyo, madrasso mein jaao, allahu akbar bolo, bakriyo ke saath so jaao. Ye global politics tumhare bas ke baahar hai.",0
Cricket News: Pakistan Main Acha Waqt Guzaar Rahe Hain. Shaiqeen Buhat Ache Hain. Wicket Buhat Achi Thi. Hashim Amla,0
Kanoon majhabi ho Par mulk dharm nirpeksh  gazab chahat h logo ki   RT=agree  #TripleTalaq @sardanarohit @nitu_ji @bobbydeol0 @Nikkynikky6,0
Siddhartha and Alia Bhatt. (Kapoor & Sons) #RakshaBandhan #Contest #Bollywood,0
ajeeb insaan ho tum chlo justify kroo triple talaq..chai k sath namkeen nai mila too TT. YEAH KYa chu***pa hai,0
"#CricKeT_News: - Bharati Women Cricket Ki Captain Ko Bold Tasveer Share Karny Par Tanqeed Ka Samna. - ""TauSeeF_M^S"" Admin: Nijam",0
"Sadiq sb, karachi main bhi cricket kee wapsee kee koshish kijeye, and in Rawalpindi as well",0
Aazkal K Balako Ki Kahani..  Muh Batak Jaisa Shauq Baazo Wale  #sarcasm #sarcastic #nadanbache #roast #roastingpeople #ikimrude,1
Ja Bhai Triple Talaq Ki ladayi kar rahi .. Halala se Inkar ya ? Pata nahi,0
bhai triple talaq se aap kya samjhte hai samjhaye aap zara ..agar triple talaq pta hota apko toh aisa nhi kehte..,0
aaj bjp aur chadhi gang aise khus ho rahe hai jaise triple talaq na ho balki 1962 ke china se badla lekar aaye ho bc,0
"Shri Ram ka comparison triple talaq se, yeh ghatiya soch dikhati h, pehla satya h, aur dusra mahilao par atyachar.",0
Waise bhi itna Bollywood support ke baad bhi akki apna highest grosser RR ko bhi paar nahi kar paya   Aisi Stardom ki jai ho,0
"@Irfanurrehman15  Asalaam O Alaikum Bhai Jamatudawa ka kya hua ,Bhai ye politics  buhat gandi aur ab iska  time khatam ho raha hai",0
Jis desh me log rhte us desh me kuch log ratragit nh gaate h ye desh ki politics h,0
"HAM BHARTIYO KE LIYE CRICKET JARURI HAI YA DESH ,DESH KI AWAAM.",0
